content,topic
"Warlords of Draenor (2014) sent players to an alternate-timeline Draenor before its destruction.",general
"It focused on the Iron Horde, led by Grommash Hellscream and other orc warlords.",lore
"Players built their own Garrison, a customizable base that produced resources and followers.",gameplay
"Character models were completely revamped for all original races.",races
"Raids like Highmaul and Blackrock Foundry challenged players at level 100.",gameplay
"Professions became tied to Garrisons and lost daily cooldowns for key crafts.",professions
"A prototype Garrison building called 'Chronomancer’s Hall' existed in early builds. (EASTER_EGG)",hidden_test
